{
  "catalog_revision": 1,
  "product": "CornellNoteWebv2",
  "requirements": [
    {
      "acceptance_criteria": [
        {
          "given": "ログインしていない利用者",
          "id": "AC-AUTH",
          "then": "本人のノート一覧が表示され、未認証のAPI取得は401になる",
          "when": "正しい認証でログインする"
        }
      ],
      "action": "maintain",
      "category": "functional",
      "id": "REQ-AUTH",
      "last_changed_by": "initial-implementation",
      "object": "本人のノート一覧が表示され、未認証のAPI取得は401になる",
      "rationale": "利用者の初期構築依頼を継続的に満たす",
      "retirement_reason": "",
      "revision": 1,
      "scope": "product",
      "source_refs": [
        "user:2026-09-05-cornellnoteweb"
      ],
      "status": "active",
      "subject": "CornellNoteWebv2",
      "superseded_by": "",
      "title": "本人のノートにログインする",
      "traces": {
        "design": [],
        "implementation": [],
        "standards": [],
        "tests": []
      },
      "type": "functional",
      "verification": {
        "evidence": "GitHub Actions quality / E2E / Pages",
        "method": "automated-tests-and-review"
      }
    },
    {
      "acceptance_criteria": [
        {
          "given": "二人の利用者が存在する",
          "id": "AC-OWNER",
          "then": "所有者以外にはノートを返さず変更しない",
          "when": "他人のノートIDで取得・変更する"
        }
      ],
      "action": "maintain",
      "category": "functional",
      "id": "REQ-OWNER",
      "last_changed_by": "initial-implementation",
      "object": "所有者以外にはノートを返さず変更しない",
      "rationale": "利用者の初期構築依頼を継続的に満たす",
      "retirement_reason": "",
      "revision": 1,
      "scope": "product",
      "source_refs": [
        "user:2026-09-05-cornellnoteweb"
      ],
      "status": "active",
      "subject": "CornellNoteWebv2",
      "superseded_by": "",
      "title": "他人のノートを保護する",
      "traces": {
        "design": [],
        "implementation": [],
        "standards": [],
        "tests": []
      },
      "type": "functional",
      "verification": {
        "evidence": "GitHub Actions quality / E2E / Pages",
        "method": "automated-tests-and-review"
      }
    },
    {
      "acceptance_criteria": [
        {
          "given": "ノートにコレクションが設定されている",
          "id": "AC-LIST",
          "then": "自身の全ノートをコレクション別に閲覧できる",
          "when": "一覧画面を開く"
        }
      ],
      "action": "maintain",
      "category": "functional",
      "id": "REQ-LIST",
      "last_changed_by": "initial-implementation",
      "object": "自身の全ノートをコレクション別に閲覧できる",
      "rationale": "利用者の初期構築依頼を継続的に満たす",
      "retirement_reason": "",
      "revision": 1,
      "scope": "product",
      "source_refs": [
        "user:2026-09-05-cornellnoteweb"
      ],
      "status": "active",
      "subject": "CornellNoteWebv2",
      "superseded_by": "",
      "title": "ノートを分類して表示する",
      "traces": {
        "design": [],
        "implementation": [],
        "standards": [],
        "tests": []
      },
      "type": "functional",
      "verification": {
        "evidence": "GitHub Actions quality / E2E / Pages",
        "method": "automated-tests-and-review"
      }
    },
    {
      "acceptance_criteria": [
        {
          "given": "複数のノートがある",
          "id": "AC-SEARCH",
          "then": "タイトルと本文・問い・まとめで絞り込める",
          "when": "語句を入力する"
        }
      ],
      "action": "maintain",
      "category": "functional",
      "id": "REQ-SEARCH",
      "last_changed_by": "initial-implementation",
      "object": "タイトルと本文・問い・まとめで絞り込める",
      "rationale": "利用者の初期構築依頼を継続的に満たす",
      "retirement_reason": "",
      "revision": 1,
      "scope": "product",
      "source_refs": [
        "user:2026-09-05-cornellnoteweb"
      ],
      "status": "active",
      "subject": "CornellNoteWebv2",
      "superseded_by": "",
      "title": "ノートの内容を検索する",
      "traces": {
        "design": [],
        "implementation": [],
        "standards": [],
        "tests": []
      },
      "type": "functional",
      "verification": {
        "evidence": "GitHub Actions quality / E2E / Pages",
        "method": "automated-tests-and-review"
      }
    },
    {
      "acceptance_criteria": [
        {
          "given": "本人のノートを開いている",
          "id": "AC-EDIT",
          "then": "再読込後も三欄が保持される",
          "when": "問い・記録・まとめを保存する"
        }
      ],
      "action": "maintain",
      "category": "functional",
      "id": "REQ-EDIT",
      "last_changed_by": "initial-implementation",
      "object": "再読込後も三欄が保持される",
      "rationale": "利用者の初期構築依頼を継続的に満たす",
      "retirement_reason": "",
      "revision": 1,
      "scope": "product",
      "source_refs": [
        "user:2026-09-05-cornellnoteweb"
      ],
      "status": "active",
      "subject": "CornellNoteWebv2",
      "superseded_by": "",
      "title": "コーネル式の三欄を編集する",
      "traces": {
        "design": [],
        "implementation": [],
        "standards": [],
        "tests": []
      },
      "type": "functional",
      "verification": {
        "evidence": "GitHub Actions quality / E2E / Pages",
        "method": "automated-tests-and-review"
      }
    },
    {
      "acceptance_criteria": [
        {
          "given": "ノートを編集中",
          "id": "AC-TASK",
          "then": "保存後もタスク状態を保持する",
          "when": "期日付きタスクを追加・完了・削除する"
        }
      ],
      "action": "maintain",
      "category": "functional",
      "id": "REQ-TASK",
      "last_changed_by": "initial-implementation",
      "object": "保存後もタスク状態を保持する",
      "rationale": "利用者の初期構築依頼を継続的に満たす",
      "retirement_reason": "",
      "revision": 1,
      "scope": "product",
      "source_refs": [
        "user:2026-09-05-cornellnoteweb"
      ],
      "status": "active",
      "subject": "CornellNoteWebv2",
      "superseded_by": "",
      "title": "チェックリストを管理する",
      "traces": {
        "design": [],
        "implementation": [],
        "standards": [],
        "tests": []
      },
      "type": "functional",
      "verification": {
        "evidence": "GitHub Actions quality / E2E / Pages",
        "method": "automated-tests-and-review"
      }
    },
    {
      "acceptance_criteria": [
        {
          "given": "所有者がノートを保存している",
          "id": "AC-SHARE",
          "then": "ログイン不要で閲覧のみできる",
          "when": "共有範囲を確認してリンクを発行する"
        }
      ],
      "action": "maintain",
      "category": "functional",
      "id": "REQ-SHARE",
      "last_changed_by": "initial-implementation",
      "object": "ログイン不要で閲覧のみできる",
      "rationale": "利用者の初期構築依頼を継続的に満たす",
      "retirement_reason": "",
      "revision": 1,
      "scope": "product",
      "source_refs": [
        "user:2026-09-05-cornellnoteweb"
      ],
      "status": "active",
      "subject": "CornellNoteWebv2",
      "superseded_by": "",
      "title": "閲覧リンクを発行する",
      "traces": {
        "design": [],
        "implementation": [],
        "standards": [],
        "tests": []
      },
      "type": "functional",
      "verification": {
        "evidence": "GitHub Actions quality / E2E / Pages",
        "method": "automated-tests-and-review"
      }
    },
    {
      "acceptance_criteria": [
        {
          "given": "有効な共有リンクがある",
          "id": "AC-REVOKE",
          "then": "既存リンクでの閲覧を拒否する",
          "when": "所有者が共有を解除する"
        }
      ],
      "action": "maintain",
      "category": "functional",
      "id": "REQ-REVOKE",
      "last_changed_by": "initial-implementation",
      "object": "既存リンクでの閲覧を拒否する",
      "rationale": "利用者の初期構築依頼を継続的に満たす",
      "retirement_reason": "",
      "revision": 1,
      "scope": "product",
      "source_refs": [
        "user:2026-09-05-cornellnoteweb"
      ],
      "status": "active",
      "subject": "CornellNoteWebv2",
      "superseded_by": "",
      "title": "共有リンクを解除する",
      "traces": {
        "design": [],
        "implementation": [],
        "standards": [],
        "tests": []
      },
      "type": "functional",
      "verification": {
        "evidence": "GitHub Actions quality / E2E / Pages",
        "method": "automated-tests-and-review"
      }
    },
    {
      "acceptance_criteria": [
        {
          "given": "発行から7日が経過する",
          "id": "AC-EXPIRY",
          "then": "期限切れを返す",
          "when": "リンクを開く"
        }
      ],
      "action": "maintain",
      "category": "functional",
      "id": "REQ-EXPIRY",
      "last_changed_by": "initial-implementation",
      "object": "期限切れを返す",
      "rationale": "利用者の初期構築依頼を継続的に満たす",
      "retirement_reason": "",
      "revision": 1,
      "scope": "product",
      "source_refs": [
        "user:2026-09-05-cornellnoteweb"
      ],
      "status": "active",
      "subject": "CornellNoteWebv2",
      "superseded_by": "",
      "title": "共有リンクの期限を守る",
      "traces": {
        "design": [],
        "implementation": [],
        "standards": [],
        "tests": []
      },
      "type": "functional",
      "verification": {
        "evidence": "GitHub Actions quality / E2E / Pages",
        "method": "automated-tests-and-review"
      }
    },
    {
      "acceptance_criteria": [
        {
          "given": "同じノートを複数画面で開く",
          "id": "AC-CONFLICT",
          "then": "409を返し最新保存を上書きしない",
          "when": "古いversionで保存する"
        }
      ],
      "action": "maintain",
      "category": "functional",
      "id": "REQ-CONFLICT",
      "last_changed_by": "initial-implementation",
      "object": "409を返し最新保存を上書きしない",
      "rationale": "利用者の初期構築依頼を継続的に満たす",
      "retirement_reason": "",
      "revision": 1,
      "scope": "product",
      "source_refs": [
        "user:2026-09-05-cornellnoteweb"
      ],
      "status": "active",
      "subject": "CornellNoteWebv2",
      "superseded_by": "",
      "title": "同時更新の上書きを防ぐ",
      "traces": {
        "design": [],
        "implementation": [],
        "standards": [],
        "tests": []
      },
      "type": "functional",
      "verification": {
        "evidence": "GitHub Actions quality / E2E / Pages",
        "method": "automated-tests-and-review"
      }
    },
    {
      "acceptance_criteria": [
        {